{
  "$schema": "https://cochinoraptor.github.io/WebMCPcss/api/schema/components.json",
  "name": "WebMCPcss Component Hub",
  "version": "1.3.0",
  "generatedAt": "2026-09-13T23:39:44.107Z",
  "baseUrl": "https://cochinoraptor.github.io/WebMCPcss",
  "categories": [
    {
      "id": "buttons",
      "label": "Botones",
      "count": 20
    },
    {
      "id": "cards",
      "label": "Tarjetas",
      "count": 10
    },
    {
      "id": "forms",
      "label": "Formularios",
      "count": 10
    },
    {
      "id": "layout",
      "label": "Layout",
      "count": 10
    },
    {
      "id": "animations",
      "label": "Animaciones",
      "count": 4
    },
    {
      "id": "intelligent",
      "label": "Inteligentes",
      "count": 4
    }
  ],
  "libraries": [
    {
      "id": "core",
      "label": "Core (sin librería)",
      "count": 18
    },
    {
      "id": "tailwind",
      "label": "Tailwind CSS",
      "count": 10
    },
    {
      "id": "bootstrap",
      "label": "Bootstrap",
      "count": 10
    },
    {
      "id": "mui",
      "label": "Material UI",
      "count": 10
    },
    {
      "id": "shadcn",
      "label": "shadcn/ui",
      "count": 10
    }
  ],
  "components": [
    {
      "id": "core-button-icon",
      "name": "Button Icon",
      "category": "buttons",
      "library": "core",
      "version": "1.0.0",
      "description": "Botón con icono IA-First: acción puntual (descargar, compartir) con texto accesible y confirmación requerida; herramienta downloadReport.",
      "tags": [
        "button",
        "icon",
        "download",
        "action",
        "core"
      ],
      "tools": [
        {
          "name": "downloadReport",
          "selector": ".wm-btn--icon",
          "description": "Descarga el informe en PDF (requiere confirmación del usuario)",
          "params": [],
          "intent": "action",
          "confirmation": "needed"
        }
      ],
      "context": [],
      "animations": [],
      "hash": "1db6944641bd559f",
      "files": {
        "css": "components/core-button-icon/button-icon.webmcp.css",
        "html": "components/core-button-icon/button-icon.html",
        "meta": "components/core-button-icon/component.json",
        "page": "components/core-button-icon/"
      },
      "importCommand": "npx webmcpcss components import core-button-icon",
      "promptExamples": [
        "cambia el icono del botón Descargar por una flecha",
        "pon el botón con icono en gris"
      ],
      "animateExamples": [
        "haz que el botón Descargar pulse suavemente",
        "aplica slide-up al botón con icono"
      ]
    },
    {
      "id": "core-button-outline",
      "name": "Button Outline",
      "category": "buttons",
      "library": "core",
      "version": "1.0.0",
      "description": "Botón outline IA-First: navegación secundaria (saber más, ver detalles) con menor peso visual; herramienta learnMore con intención navigate.",
      "tags": [
        "button",
        "outline",
        "navigate",
        "link",
        "core"
      ],
      "tools": [
        {
          "name": "learnMore",
          "selector": ".wm-btn--outline",
          "description": "Abre más información o los detalles del elemento (navegación secundaria)",
          "params": [],
          "intent": "navigate",
          "confirmation": "none"
        }
      ],
      "context": [],
      "animations": [],
      "hash": "36476437ef609305",
      "files": {
        "css": "components/core-button-outline/button-outline.webmcp.css",
        "html": "components/core-button-outline/button-outline.html",
        "meta": "components/core-button-outline/component.json",
        "page": "components/core-button-outline/"
      },
      "importCommand": "npx webmcpcss components import core-button-outline",
      "promptExamples": [
        "cambia el borde del botón Saber más a morado",
        "convierte el botón outline en relleno"
      ],
      "animateExamples": [
        "añade un brillo al pasar el ratón por el botón outline",
        "aplica fade-in al botón Saber más"
      ]
    },
    {
      "id": "core-button-primary",
      "name": "Button Primary",
      "category": "buttons",
      "library": "core",
      "version": "1.0.0",
      "description": "Botón primario IA-First: ejecuta la acción principal del bloque (enviar, guardar, continuar) y la declara como herramienta clickButton.",
      "tags": [
        "button",
        "primary",
        "submit",
        "cta",
        "core"
      ],
      "tools": [
        {
          "name": "clickButton",
          "selector": ".wm-btn--primary",
          "description": "Ejecuta la acción principal del bloque (enviar, guardar o continuar)",
          "params": [],
          "intent": "submit",
          "confirmation": "none"
        }
      ],
      "context": [],
      "animations": [],
      "hash": "81d8e0c499f6f3ff",
      "files": {
        "css": "components/core-button-primary/button-primary.webmcp.css",
        "html": "components/core-button-primary/button-primary.html",
        "meta": "components/core-button-primary/component.json",
        "page": "components/core-button-primary/"
      },
      "importCommand": "npx webmcpcss components import core-button-primary",
      "promptExamples": [
        "cambia el color del botón primario a verde",
        "haz el botón Enviar más grande"
      ],
      "animateExamples": [
        "aplica una animación de pulsación al botón primario",
        "haz que el botón Enviar aparezca con fade-in"
      ]
    },
    {
      "id": "core-button-secondary",
      "name": "Button Secondary",
      "category": "buttons",
      "library": "core",
      "version": "1.0.0",
      "description": "Botón secundario IA-First: cancela o vuelve atrás sin efectos destructivos; herramienta cancelAction con intención cancel.",
      "tags": [
        "button",
        "secondary",
        "cancel",
        "core"
      ],
      "tools": [
        {
          "name": "cancelAction",
          "selector": ".wm-btn--secondary",
          "description": "Cancela la acción en curso o vuelve al paso anterior sin efectos destructivos",
          "params": [],
          "intent": "cancel",
          "confirmation": "none"
        }
      ],
      "context": [],
      "animations": [],
      "hash": "ec2c7f8376b716e6",
      "files": {
        "css": "components/core-button-secondary/button-secondary.webmcp.css",
        "html": "components/core-button-secondary/button-secondary.html",
        "meta": "components/core-button-secondary/component.json",
        "page": "components/core-button-secondary/"
      },
      "importCommand": "npx webmcpcss components import core-button-secondary",
      "promptExamples": [
        "oculta el botón Cancelar",
        "cambia el texto del botón secundario a Volver"
      ],
      "animateExamples": [
        "haz que el botón Cancelar aparezca deslizándose",
        "quita la animación del botón secundario"
      ]
    },
    {
      "id": "tailwind-button-icon",
      "name": "Button Icon",
      "category": "buttons",
      "library": "tailwind",
      "version": "1.0.0",
      "description": "Botón con icono IA-First: acción puntual (descargar, compartir) con texto accesible y confirmación requerida; herramienta downloadReport.",
      "tags": [
        "button",
        "icon",
        "download",
        "action",
        "tailwind"
      ],
      "tools": [
        {
          "name": "downloadReport",
          "selector": "[data-tool=\"downloadReport\"]",
          "description": "Descarga el informe en PDF (requiere confirmación del usuario)",
          "params": [],
          "intent": "action",
          "confirmation": "needed"
        }
      ],
      "context": [],
      "animations": [],
      "hash": "2c9ce868946adfca",
      "files": {
        "css": "components/tailwind-button-icon/button-icon.webmcp.css",
        "html": "components/tailwind-button-icon/button-icon.html",
        "meta": "components/tailwind-button-icon/component.json",
        "page": "components/tailwind-button-icon/"
      },
      "importCommand": "npx webmcpcss components import tailwind-button-icon",
      "promptExamples": [
        "cambia el icono del botón Descargar por una flecha",
        "pon el botón con icono en gris"
      ],
      "animateExamples": [
        "haz que el botón Descargar pulse suavemente",
        "aplica slide-up al botón con icono"
      ]
    },
    {
      "id": "tailwind-button-outline",
      "name": "Button Outline",
      "category": "buttons",
      "library": "tailwind",
      "version": "1.0.0",
      "description": "Botón outline IA-First: navegación secundaria (saber más, ver detalles) con menor peso visual; herramienta learnMore con intención navigate.",
      "tags": [
        "button",
        "outline",
        "navigate",
        "link",
        "tailwind"
      ],
      "tools": [
        {
          "name": "learnMore",
          "selector": "[data-tool=\"learnMore\"]",
          "description": "Abre más información o los detalles del elemento (navegación secundaria)",
          "params": [],
          "intent": "navigate",
          "confirmation": "none"
        }
      ],
      "context": [],
      "animations": [],
      "hash": "989eef7c7f281412",
      "files": {
        "css": "components/tailwind-button-outline/button-outline.webmcp.css",
        "html": "components/tailwind-button-outline/button-outline.html",
        "meta": "components/tailwind-button-outline/component.json",
        "page": "components/tailwind-button-outline/"
      },
      "importCommand": "npx webmcpcss components import tailwind-button-outline",
      "promptExamples": [
        "cambia el borde del botón Saber más a morado",
        "convierte el botón outline en relleno"
      ],
      "animateExamples": [
        "añade un brillo al pasar el ratón por el botón outline",